00001	PHB depolymerase	Ralstonia pickettii	1994.0	PHB PHA	Yukawa, H., Uchida, Y., Kohama, K., & Kurusu, Y. (1994). Monitoring of polymer biodegradabilities in the environment by a DNA probe method. In Studies in Polymer Science (Vol. 12, pp. 65-76). Elsevier.	MKHPYGYRWHWLYALVVTLMTALATFSAHAAVTAGPGAWSSQQTWAADTVNGGNLTGYFYWPASQPTTPNGKRALVLVLHGCLQTASGDVIDNANGAGFNWKTIAEQYGAVVLAPNATGNVYSNHCWDYANTSPSRTSGHVGVLLDLVNRFVTNSQYAIDPNQVYVAGLSSGGGMTMVLGCIAPDIFAGIGINAGPPPAITRWKIGVVPSGYTATTAANNCKAWAGSNASSFNTQIAGAVWGTSDYTVAQAYGPMDTAAFRQIYGGTFTQGAQVSISGGGTNTPYTDSNGKLRTHEISVSGMAHAWPAGTGGDNNNYVDATHINYPAFVMDYWVKNNLRAGSGPVQSAGTPTGLTVTGTTTTSVSLSWNAVTNATSYNVYRNGSKVGSSTSTTYTDTGLIAGTTYSYTVTEIDPTAGESAQSSAVSAKTQSSFACTATTASNYAHVQAGRAHDSGGIAYANGSNQSMGLDNVFYTNTLAQTAAGYYVIGNCP
00002	PHA depolymerase	Pseudomonas fluorescens	1994.0	PHO PHA	Schirmer, A., & Jendrossek, D. (1994). Molecular characterization of the extracellular poly (3-hydroxyoctanoic acid)[P (3HO)] depolymerase gene of Pseudomonas fluorescens GK13 and of its gene product. Journal of bacteriology, 176(22), 7065-7073.	MPLRTLLCGLLLAVCLGQHALAASRCSERPRTLLRPAEVSCSYQSTWLDSGLVGQRKIIYQTPLGTPPAGGWPVVLIYQGSFFPLNDFSYHSNLPFGGYYEGKLVQNLLDHGYAVIAPSAPADLFWQTNIPGLAQAYELSTDYDFLGNVLAAIASGHFGPLNAQRQYATGISSGGYNTSRMAVSFPGKFRALAVQSGSYATCSGPLCVVPDQLPADHPPTLFLHGFVDAVVPWWSMDLYYDRLLHQGIETARYTEPLGGHEWFAASPGKVLAWFNAHP
00003	PHB depolymerase A	Paucimonas lemoignei	1995.0	PHB PHA	Jendrossek, D. I. E. T. E. R., Frisse, A. N. D. R. E. A., Behrends, A. S. T. R. I. D., Andermann, M. E. I. K. E., Kratzin, H. D., Stanislawski, T. H. O. M. A. S., & Schlegel, H. G. (1995). Biochemical and molecular characterization of the Pseudomonas lemoignei polyhydroxyalkanoate depolymerase system. Journal of Bacteriology, 177(3), 596-607.	MRNTLKAAFKLGVISAALLAPFATQAATAGPGAWSSQQTWAADSVNGGNLTGFYYWPATQPVHANGKRALVLVLHGCAQTASGDVINNGDNGYNWKAAADQYGAVILAPNATGNVSSQHCWDYSRTSHSRSTGHEYVLLDLINRFKNDPQYEIDPNQVYVTGLSSGGGETIVLGCIAPDVFAGWASNAGPTPGTTTLQIGAVPSGYTATNAKNNCLSLAGSNSSYFSTQIAGVVWGTSDFTVAPGYNPLMMDAMRQIYGGTFTKQASTSVATGGTNTTYKDSSGRVRTHELSVSGMSHAWPAGTGGQNTNYVTSQYVNYPLFVMDYFFTNNSRAGSGGGTTTTTAGGTTTTTAAGTTTTAATTTTTASSTTTTVAATCYTSSNYAHVTAGRAHNSSGYALANGSNQNMGLNNTFYTSTLKQTSPGYYVIGTCP
00004	PHB-depolymerase	Paucimonas lemoignei	1995.0	PHB PHA	Jendrossek, D. I. E. T. E. R., Frisse, A. N. D. R. E. A., Behrends, A. S. T. R. I. D., Andermann, M. E. I. K. E., Kratzin, H. D., Stanislawski, T. H. O. M. A. S., & Schlegel, H. G. (1995). Biochemical and molecular characterization of the Pseudomonas lemoignei polyhydroxyalkanoate depolymerase system. Journal of Bacteriology, 177(3), 596-607.	MLAKQIKKANSRSTLLRKSLLFAAPIILAVSSSSVYALTQVSNFGTNPGNLQMFKHVPSGMPANAPLVVALHGCTQTAAAYEASGWSALGNTHKFYVVYPQQQSGNNSNKCFNWFEPGDITRGQGEALSIKQMVDNMKANHSIDPSRVYVTGLSAGAFMTTVMAATYPDVFAGAAPIAGGPYKCATSMTSAFTCMSPGVDKTPAAWGDLARGGYSGYNGPKPKISIWHGSSDYTVAPANQNETVEQFTNYHGIDQTPDVSDTVGGFPHKVYKSANGTPLVETYTITGMGHGTPVDPGTGANQCGTAGAYILDVNVCSSYYIGQFFGIIGGGGTTTTTTSGNVTTTTAATTTTTTATQGYTQTTSATVTNHYVAGRINVTQYNVLGARYGYVTTIPLYYCPSLSGWTDKANCSPI
00005	PHA depolymerase B	Paucimonas lemoignei	1995.0	PHB PHA	Jendrossek, D. I. E. T. E. R., Frisse, A. N. D. R. E. A., Behrends, A. S. T. R. I. D., Andermann, M. E. I. K. E., Kratzin, H. D., Stanislawski, T. H. O. M. A. S., & Schlegel, H. G. (1995). Biochemical and molecular characterization of the Pseudomonas lemoignei polyhydroxyalkanoate depolymerase system. Journal of Bacteriology, 177(3), 596-607.	MMSSQTTQSSKFSLFLKRGLLLAAAPLLAMSASSALAATQVTGFGSNPGNLLMYKHVPSSMPANAPLVIAMHGCTQSASAYEATGWTQLANTYKFYVVYPEQQSSNNQNKCFNWFEPGDIARGQGEALSIKQMVDKMKADHSIDTNRVYVTGLSAGGYMVNVMLATYPDVFAGGAPFSGGPYNCATSMTNAFTCMSPGVDKTPAAWGDLARGGYSGYTGRKPIVSIWHGDADYTVKQSNQVEEVEQWTNYHGIDQTADVSDTVAGFPHKVYKDASGNALVETYTITGMGHGTPVDPGTGSLQCGTAGAYILDVNICSSYYVAKFWGLIGGSGTTTTTSAGTTTTTSAGTTTTKASTTTTKVSTTTTASTTTTTAGACYNSSNYAHVTAGRAHDTGGYAYTNGSNQKMGLNNTFYTSKLRKTGTNYYVIDTTCP
00006	PHB depolymerase	Paucimonas lemoignei	1995.0	PHB PHA	Jendrossek, D. I. E. T. E. R., Frisse, A. N. D. R. E. A., Behrends, A. S. T. R. I. D., Andermann, M. E. I. K. E., Kratzin, H. D., Stanislawski, T. H. O. M. A. S., & Schlegel, H. G. (1995). Biochemical and molecular characterization of the Pseudomonas lemoignei polyhydroxyalkanoate depolymerase system. Journal of Bacteriology, 177(3), 596-607.	MQLKKSLRVTIAVLLGAGVSASAFALTPGSGTWVKESATYGTPNLQDAYLYVPKNPAPQVLGGKRALMLSLHGCGQTASTSVIDKRFNWEETAEKYGMVVVAPTVPTGTSSTRAASGCWDWFGTAHNRTTRDVVPLIKLIDAVKARTNLDIDPNQIYVSGLSAGAGETHVLGCSFPDYFAGVAPNASPSLGSAAGDISVPPKRTPQQVADMCRAINGNQFNAHLDTQIFATVYGDKDYLVLPAHNEVNRDGMKIAYDATVSAGTASVDGGGTASLFKDSRGRLRISSMVVAGMSHAWPSGPGAAPYIAWVDSTRVNYPAYVTQFFFENNLRVNKWKITCSVNVPNASSATVSASATAAAGATVASYRVALQGKTAINDNAAGSGTSLNKSYNLGNGIYAGTVTAVDSKGVESEACQLSSFQVGQLDPLYPPSDIQATGISSSSIKLNWSAVSSATAYDVRRNGGAPVRVTATQYTDTGLAPDTSYSYTVTSVNDNMTSGQSGQIIGKTQPVTYTEKVTATVTGHYSAGRINVNQYLQLGAKYGYNASLTLYKCEGVWTNSSSCGPLQ
00007	PHB depolymerase	Paucimonas lemoignei	1995.0	PHB PHA	Jendrossek, D. I. E. T. E. R., Frisse, A. N. D. R. E. A., Behrends, A. S. T. R. I. D., Andermann, M. E. I. K. E., Kratzin, H. D., Stanislawski, T. H. O. M. A. S., & Schlegel, H. G. (1995). Biochemical and molecular characterization of the Pseudomonas lemoignei polyhydroxyalkanoate depolymerase system. Journal of Bacteriology, 177(3), 596-607.	MNKYLKNLCFAAATVTLMASAPSAFALSEVTGFGTNPGALKMFKHVPTSMPTNAPLIVAMHGCTQSASAYEGSGWSALANNYKFYVVYPEQQSGNNSNKCFNWFESGDIARGQGEALSIKQMVDKMKADYSIDANRVYVTGLSAGAFMTAVMAATYPDVFAGAAPIAGGPYKCATSMIDAFSCMSPGTDKTPAAWGDLARGGYSGYNGRKPKISVWQGSSDTTVKPMNMDELMQQWTNYHGIDQTADVSETVKGFPHKVYKDASGNALVETWSITGMAHGTPVDPGTGAEQCGTSGSYILDVNICSSYHIAQFFGLTGAGTTTTTTVGSTSTTTGYTSTSSAPVTTTTSVASTTTTTVAAGACYNASNYAHVTAGRAVNSMGYAKAKGSNQNMGLYNTFTTSKLREAPAGYFTIDSTCP
00008	Cutinase	Fusarium verticillioides	1996.0	PCL	Murphy, C. A., Cameron, J. A., Huang, S. J., & Vinopal, R. T. (1996). Fusarium polycaprolactone depolymerase is cutinase. Appl. Environ. Microbiol., 62(2), 456-460.	MKFFALTTLLAATASALPTSHPVQELEARQLGGGTTRNDLTNGNSASCADVIFIYARGSTETGNLGTLGPSIASKLESAFGRDGVWIQGVGGAYRATLGDNSLPRGTSSAAIREMLGLFQQANTKCPDATLIAGGYSQGAALGAASVEDLDSAIRDKIAGTVLFGYTKNLQNHGRIPNFPADRTKVFCNTGDLVCTGSLIIAAPHLTYGPDARGPAPEFLIEKVRAVRGSA
00009	Cutinase	Fusarium verticillioides	1996.0	PCL	Murphy, C. A., Cameron, J. A., Huang, S. J., & Vinopal, R. T. (1996). Fusarium polycaprolactone depolymerase is cutinase. Appl. Environ. Microbiol., 62(2), 456-460.	MKFFALTTLLAATDSALPTSHPVQELEARQLGGGTTRNDLTNGNSASCADVIFIYARGSTETGNLGTLGPSIASKLESAFGRDGVWIQGVGGAYRATLGDNSLPRGTSSAAIREMLGLFQQPNTKCPDATLIAGGYSQGAALAAASVEDLDSAIRDKIAGTVLFGYTKNLQNHGRIPNFPADRTKVFCNTGDLVCTGSLIIAAPHLTYGPDARGPAPEFLIEKVRAVRGSA
00010	PVA dehydrogenase	Pseudomonas sp.	1996.0	PVA	SHIMAO, M., TAMOGAMI, T., NISHI, K., & HARAYAMA, S. (1996). Cloning and characterization of the gene encoding pyrroloquinoline quinone-dependent poly (vinyl alcohol) dehydrogenase of Pseudomonas sp. strain VM15C. Bioscience, biotechnology, and biochemistry, 60(7), 1056-1062.	MQQNIERNQVSMTTSRFVWGAVMALVALGSASAAELNLPDGAALYRARCGTCHDNPQDRTPARDVIARNSPAFIMAAMNGVMAPMAAGLSEAEKQAIALHLGARPAGGSQEINPHAIWGPPSASMPLDGPKCKGKIPPIDLSTPDQWNGWGAGITNARFQPNPGLTAADVPRLKVKWAFNYPGSKNGQATVVGDRLFVTSMSGAVYALNAKTGCVYWRHDAAAATRSSVHVVQLPAGAPAQYAIFFSDWTKAAVALDAQTGKQLWKTTIDDQPGVQMTGSPTYHEGKLFVPISSGNEAFATNDQWECCKFRGALVALDALSGKVLWKTYTTQKEPAPFRLNKLGKQMWGPAGGSIWSAPTIDPKRGLVYVATSNSYTEVHHEGSDAVMAMEIETGKVRWINQVTKDDNYIIGCPRAANCPEKVGPDFALGNSPILHTLQDGRQYIVVGQKSGAVYAMDPDNDGELIWMRRVSPGSELGGVEFGMAADAENVYVGISDVITRKGGKPGVYALRIRDGADVWAFPAPRTPCRWNNIFCHPAVSQAVTAMPGVVFAGSMDGHFRAFSTSDGKVLWEFNTAAAPYKTVAGKQADGGVMDGAGPTIAGGMVYVHSGYAGRSTQNAGDLRGREGNVLIAFSVDGK
00011	PHB-depolymerase	Comamonas acidovorans	1997.0	PHB PHA	Kasuya, K. I., Inoue, Y., Tanaka, T., Akehata, T., Iwata, T., Fukui, T., & Doi, Y. (1997). Biochemical and molecular characterization of the polyhydroxybutyrate depolymerase of Comamonas acidovorans YM1609, isolated from freshwater. Appl. Environ. Microbiol., 63(12), 4844-4852.	MAFNFIRAAAAGAAMALCGVGSVHAAVNLPALKIDKTQTTVSGLSSGGFMAVQLHVAYSATFAKGAGVVAGGPFYCAEGSIVNATGRCMASPAGIPTSTLVSTTNTWASQGVIDPVANLQNSKVYLFSGTLDSVVKTGVMDALRTYYNSFVPAANVVYKKDIAAEHAMVTDDYGNACSTKGAPYISDCNFDLAGAMLQHLYGTLNARNNATLPTGNYIEFNQSEFITNHGMATTGWAYVPQACQAGGTATCKLHVVLHGCKQNIGDVQQQYVRNTGYNRWADTNNIVMLYPQTSTAATNSCWDWWGYDSANYSKKSGPQMAAIKAMVDRVSSGTGGTTPPDPVALPAPTGVSTSGATASSMAIGWAAVMGAASYNVYRNANKVNALPVTATSYTDTGLAASTTYSWTVRAADANGAEGATSAAASGTTLAASGGGTATCTTASNYAHTLAGRAYAAGGYTYALGSNQNMGLWNVFVTNTLKQTSTNYYVIGTCP
00012	PHB-depolymerase	Alcaligenes faecalis	1997.0	PHB PHA	Kita, K., Mashiba, S. I., Nagita, M., Ishimaru, K., Okamoto, K., Yanase, H., & Kato, N. (1997). Cloning of poly (3-hydroxybutyrate) depolymerase from a marine bacterium, Alcaligenes faecalis AE122, and characterization of its gene product. Biochimica et Biophysica Acta (BBA)-Gene Structure and Expression, 1352(1), 113-122.	MTSRPMRSLVIAFLTLVAAAAPALAGAGAWQNNLSLGGFNKVHLYTPDGDSPVGNGKALLIVLHGCTQSIDAYKTANLEVAAEEYGMVVAVPDAMNKAGFSCWSYWQGTKSRSAGDYKNLINLANTLSGDAARGIDPNQVYIAGLSSGASFANTTACLAPDVFAGVGVSAGPSVGTSSSGAIGTCEQADVESRCRDLGGGYQSAFDTQVASIAHGDADTTVDTCYNRQNAEGMAGLYGVSEVAGSTVINADGGSAEEFLWQDGRVSMLWFHGLDHSWSGGQGASGSYVSGASINYARYLGGFFAEHNARIDRNRVPTLAQVDVTASADRIQVSGQASDEDGTVSSVAIVIEGVNGGGATLAAAIDNNGYFQATSDPLADGLYTVAVTAADDDGGESEPAIRTVRVGPEPPASAPVLSDIAVSVDGQCATVSGQVVDENQDLAGVTVTFASGVRAAGIDGVRYSARACDLPGGAQNATVSAEDEGGLSSGDQIDFVIDAGQTATLDQHISAGRLDYTNYADCYLEYGADAFKLTEATVSGQCQWQDDDASCAGPVQACSGAGGGGDPQPQPGDECQTQSTYNYYHKVAGRAYSTGNYYAPDYFAQGSDEPMAGSTWGLTALYSEDGGNVWRLGECP
00013	PU-esterase 	Comamonas acidovorans	1998.0	PU	Nomura, N., Shigeno-Akutsu, Y., Nakajima-Kambe, T., & Nakahara, T. (1998). Cloning and sequence analysis of a polyurethane esterase of Comamonas acidovorans TB-35. Journal of fermentation and bioengineering, 86(4), 339-345.	MNSRSLTKAIRFPTILALAGFSVLGACGGSDNDSSSNNQGAPAVAITVAGQVQAVDRLGMRRYFGIPFAAPPVGNLRWMPPAPPQSWAAPLAKTQSNAPCMQTGATDPLRLPNGTEDCLYLDVHAPATGEGPFPVMVWIHGGAFSIGGTITYADPSPLVSKGVIVVNIAYRMGAMGFLGHPSLRAADGTVGNYGIMDQQAALRWVQDNIAAFGGDKSNVTIFGESAGGFSVMTHLASPLSKGLFAKAIVQSGGYGFDRQLTQAQLEAQSTSIVNSALAAAGVSCPTVDAACLRGLSAELVNNQLATAFTTANWSPVPSVDGKVLPKSIKATFVAGENNKVPLVNGSNQDEWSYFVASRELVAGPLTAAQYPSYLQTSLGLPPSLATVYPLTDYGTNTAQQPSLAATAAGTDMHFSCPALNLSKRVLSQATPIFMYEFRDRTAIPSIGRNTISFNQGAGHTYELQYLFNLRDLETAEHRDLQASMARYWTNFARTSNPNNGDPVATSWPAFTGPTKVLGLDVASAGGIRELATFETDHKCNTAWTSLTF
00014	PHB depolymerase	Acidovorax sp.	1999.0	PHB PPL PHA	Kobayashi, T., Sugiyama, A., Kawase, Y., Saito, T., Mergaert, J., & Swings, J. (1999). Biochemical and genetic characterization of an extracellular poly (3-hydroxybutyrate) depolymerase from Acidovorax sp. strain TP4. Journal of environmental polymer degradation, 7(1), 9-18.	MAFNFIRAAAAGAAIALCGVASVHAAVNLPALKIDKTQTTVSGLSSGGFMAVQLHVAYSATFAKGVGVVAGGPFYCAEGSVVNATGRCMASPTGIPTSTLVNTTNTWAGQGVIDPVANLQNSKVYLFSGTLDSVVKTGVMDALRTYYNSFVPAANVVYKKDIASEHAMVTDDYGNGCSTKGAPYISDCNFDLAGAMLQHLYGTLNARNNATLPSGNFIEFNQSEFISNHGMATTGWAYVPQACQAGGTATCKLHVVLHGCKQNVNDVQQQYVRNTGYNRWADSNNIVMLYPQTSLAATNSCWDWWGYDSANYSKKSGPQMAAIKAMVDRVGSGGTTNPPVDLPAPTGVKPSGATASSMAIGWNAVSGGPSYNVYRNGNKTNALPVTATNFTDTGLAASTTYSWTVRAADGNGAEGAVSAAASGTTLAASGGGTGTCTTASNYAHTMAGRAYVYGGYTFALGSNQSMGLWNIFVNKTLKQTSPNYYVIGTCP
00015	PHB depolymerase	Comamonas acidovorans	1999.0	P3HP P4HB PEA PES PHB PHA	Kasuya, K. I., Ohura, T., Masuda, K., & Doi, Y. (1999). Substrate and binding specificities of bacterial polyhydroxybutyrate depolymerases. International journal of biological macromolecules, 24(4), 329-336.	MAFNFIRAAAAGAAMALCGVGSVHAAVNLPALKIDKTQTTVSGLSSGGFMAVQLHVAYSATFAKGAGVVAGGPFYCAEGSIVNATGRCMASPAGIPTSTLVSTTNTWASQGVIDPVANLQNSKVYLFSGTLDSVVKTGVMDALRTYYNSFVPAANVVYKKDIAAEHAMVTDDYGNACSTKGAPYISDCNFDLAGAMLQHLYGTLNARNNATLPTGNYIEFNQSEFITNHGMATTGWAYVPQACQAGGTATCKLHVVLHGCKQNIGDVQQQYVRNTGYNRWADTNNIVMLYPQTSTAATNSCWDWWGYDSANYSKKSGPQMAAIKAMVDRVSSGTGGTTPPDPVALPAPTGVSTSGATASSMAIGWAAVMGAASYNVYRNANKVNALPVTATSYTDTGLAASTTYSWTVRAADANGAEGATSAAASGTTLAASGGGTATCTTASNYAHTLAGRAYAAGGYTYALGSNQNMGLWNVFVTNTLKQTSTNYYVIGTCP
00016	Polyurethane esterase A	Pseudomonas chlororaphis	1999.0	PU	Howard, G. T., Ruiz, C., & Hilliard, N. P. (1999). Growth of Pseudomonas chlororaphis on apolyester–polyurethane and the purification andcharacterization of a polyurethanase–esterase enzyme. International biodeterioration & biodegradation, 43(1-2), 7-12.	MGVFDYKNFTASDSKALFSDALAITLYSYHNIDNGFAEGYQHNGFGLGLPATLVTALIGSGNSQGVIPGIPWNPDSEKAALDALHQAGWSTISAQQLGYDGKVDGRGTFFGEKAGYGTAQVEILGKYDAQGHLESIGIAFRGTSGPRESVISDTIGDVINDLLAALGPKDYAKNYAGEAFGKLLGDVAAFAQANGLSGKDVLVSGHSLGGLGVNSLADLSSERWSGFYKDSNYIAYASPTQSASDKVLNIGYENDPVFRALDGSTFNLSSLGVHDAHQDSATNNIVNFNDHYASTLWNVLPSSILNIPTWLSHLPTGYGDGLSRVLESKFYDFTSKDSTIVVANLSDPARASTWVQDLNRNAETHKGSTFIIGSDGNDLIQGGSGNDYLEGRAGNDTFRDSGGYNIILGGQGSNTLDLQQSVKNYSFASDGAGTLYLRDANGGISMTRDIGAIQSKEPGFLWGLFKDDVIHQVTDQGLKAGGQLTQYASSVRGDAGDNVLKAHAGGDWLFGLDGNDHLIGGQGNDVFVGGAGNDLMEAGGGNNTFLFTGHFGQDRILGYQGGDKLVFMGVSGVLPDQDYRAHASSSGNDTVLTFGQDSVTLVGVSLEHLNGSGIVLA
00017	PHB depolymerase	Comamonas testosteroni	1999.0	PHB PHA	Kasuya, K. I., Ohura, T., Masuda, K., & Doi, Y. (1999). Substrate and binding specificities of bacterial polyhydroxybutyrate depolymerases. International journal of biological macromolecules, 24(4), 329-336.	MRVQSWRSGVAALALWGGVNLAAGAAVPLGQYNIATDQISVSGLSSGGFMANQLGNAYSASFMGVGIFAAGPYMCAGLNNYTACMYNASISSAQLNAMQSSIDSYSSAASIDAKSRIAAQKIYIFTGTSDYTVGPNLTDALQTQYLNNGVPQGNIAYVKRSGAAHVLPTDFDSSGNNACSSSASPYISNCGYDGAKAALTHFYGALNPRNDAPATGNYIEFNQASYTNANPGMASTGWLYVPQSCASGTQCRLHVVLHGCQQSTDKIGDKFVRNTGFSRWADTNNIIVLYPQTQVDNNNRSTSKSGSLANPNACWDWIGWYGNNFAQKSGVQMTAIKAMIDRIASGAGSGTGGGNGGGTPTQPALAAPTGLGASAATSTSMQLDWAPVTSAAGYNVYRNGNKANALTVYATSYVDAALNPATSYSWTVRAVDGNGAESADSAAVSASTLTGSNPAGTCTTASNYAHVQANRAYQQGGYAYANGSGQNMGLWNVFYTTTLKQTGSNYYVIGTCP
00018	PHB depolymerase	Stutzerimonas stutzeri	1999.0	P3HP P4HB PEA PES PHB PHA	Kasuya, K. I., Ohura, T., Masuda, K., & Doi, Y. (1999). Substrate and binding specificities of bacterial polyhydroxybutyrate depolymerases. International journal of biological macromolecules, 24(4), 329-336.	MTKQSLPQGMADQRLCRFFTAALCSLLMLLLWPTTVTAGQTFSYTSPQQAYSGSRERSYKVYVPTGLSTPAPMVMALHGCRQTNDDVLNDWGLKAAADRYGFILVAPFITSYDGLRNENCWGFWFEQHIHQGGGEVADLHRIAQQVEANFVIDANRRFITGLSSGGAMALVAAVAYNEYWAAAAPAAGLPYRETASSVSLSGQCPGSATFRSVSQVAADMRSEVNDAYPIPLMILQNRNDCTVLQTAANNMRDAHLQVFGSASRNTPATTKASDTGCSPYHQNDYGCRHIAYTQDGTTATRSLVETVIYDGPLATPNPQDTNHGHYWIGGAQGNNGKWSLQVGPSYPDIIWDFFSRHSRDGSQPQGHPVIVLQGDNPLSVPLGSTFNDPGASASDAEDGSLPVSADCSAVNPSVVGSYSCLYSATDSDGNRSTLTRTVEVYDPNAPVETCQVVSASPSAHIGAGRAYAGGTSNLRAYAKDDGVDIGGSFDTWSNVPLYEGEPGRWYAQRPAACGGSGQAFTCQEWNASNLSHVMAGRAYYGYYTVGGNQYLGSLSGLSTWVRETAQGHFQAGRCSN
00019	PHB depolymerase	Ralstonia pickettii	1999.0	P3HP P4HB PEA PES PHB PHA	Kasuya, K. I., Ohura, T., Masuda, K., & Doi, Y. (1999). Substrate and binding specificities of bacterial polyhydroxybutyrate depolymerases. International journal of biological macromolecules, 24(4), 329-336.	MVRRLWRRIAGWLAACVAILCAFPLHAATAGPGAWSSQQTWAADSVNGGNLTGYFYWPASQPTTPNGKRALVLVLHGCVQTASGDVIDNANGAGFNWKSVADQYGAVILAPNATGNVYSNHCWDYANASPSRTAGHVGVLLDLVNRFVTNSQYAIDPNQVYVAGLSSGGGMTMVLGCIAPDIFAGIGINAGPPPGTTTAQIGYVPSGFTATTAANKCNAWAGSNAGKFSTQIAGAVWGTSDYTVAQAYGPMDAAAMRLVYGGNFTQGSQVSISGGGTNTPYTDSNGKVRTHEISVSGMAHAWPAGTGGDNTNYVDATHINYPVFVMDYWVKNNLRAGSGTGQAGSAPTGLAVTATTSTSVSLSWNAVANASSYGVYRNGSKVGSATATAYTDSGLIAGTTYSYTVTAVDPTAGESQPSAAVSATTKSAFTCTATTASNYAHVQAGRAHDSGGIAYANGSNQSMGLDNLFYTSTLAQTAAGYYIVGNCP
00021	Polyurethane esterase A	Pseudomonas chlororaphis	2000.0	PU	Stern, R. V., & Howard, G. T. (2000). The polyester polyurethanase gene (pueA) from Pseudomonas chlororaphis encodes a lipase. FEMS Microbiology Letters, 185(2), 163-168.	MGVFDYKNFTASDSKALFSDALAITLYSYHNIDNGFAEGYQHNGFGLGLPATLVTALIGSGNSQGVIPGIPWNPDSEKAALDALHQAGWSTISAQQLGYDGKVDGRGTFFGEKAGYGTAQVEILGKYDAQGHLESIGIAFRGTSGPRESVISDTIGDVINDLLAALGPKDYAKNYAGEAFGKLLGDVAAFAQANGLSGKDVLVSGHSLGGLGVNSLADLSSERWSGFYKDSNYIAYASPTQSASDKVLNIGYENDPVFRALDGSTFNLSSLGVHDAHQDSATNNIVNFNDHYASTLWNVLPSSILNIPTWLSHLPTGYGDGLSRVLESKFYDFTSKDSTIVVANLSDPARASTWVQDLNRNAETHKGSTFIIGSDGNDLIQGGSGNDYLEGRAGNDTFRDSGGYNIILGGQGSNTLDLQQSVKNYSFASDGAGTLYLRDANGGISMTRDIGAIQSKEPGFLWGLFKDDVIHQVTDQGLKAGGQLTQYASSVRGDAGDNVLKAHAGGDWLFGLDGNDHLIGGQGNDVFVGGAGNDLMEAGGGNNTFLFTGHFGQDRILGYQGGDKLVFMGVSGVLPDQDYRAHASSSGNDTVLTFGQDSVTLVGVSLEHLNGSGIVLA
00022	Oxidized PVA hydrolase 	Pseudomonas sp.	2000.0	O-PVA	Shimao, M., Tamogami, T., Kishida, S., & Harayama, S. (2000). The gene pvaB encodes oxidized polyvinyl alcohol hydrolase of Pseudomonas sp. strain VM15C and forms an operon with the polyvinyl alcohol dehydrogenase gene pvaA. Microbiology, 146(3), 649-657.	MNQSLGVLRLTRGVIALALASVASGCSSTGADRTAATPAAANPAATEPVKWECPAGYEVKEGLNVDFPHKGMKRAFIVYPAKNVSGPAPVWVPMTGSVESTNDNLTVARSGANSILADHGYTVIAPVRACANQDPNIRGERCNGPGSNGWNWNPWFEGRAADPSGEHWKNDEGPDSSFFVAMVQCVGTKYKLDARRLFLGGISSGGTMTNRALLFRSNFWAGGLPISGEWYVTSDDGTPLSFDDARAAVAAAPTKIHQGRVGPYPLPAKVGPLIVMTVWGGEKDLWNCTRPDGSRFLCADYRPSTQAGSNFFSAQPDVVHVACSSTHGHMWPQLNTQEFNRWALDTLASHPKGSDPRSFKLTQPPEGYTCHVGPFTGLY
00023	Polyurethanase	Pseudomonas chlororaphis	2001.0	PU	Howard, G. T., Crother, B., & Vicknair, J. (2001). Cloning, nucleotide sequencing and characterization of a polyurethanase gene (pueB) from Pseudomonas chlororaphis. International biodeterioration & biodegradation, 47(3), 141-149.	MSMSIFDYKTALGGDGKALYSEAITLALYASTPTGEALPGTAWRPISVSQLGYQGNVSAQGTISGEQAIVSDAQSRCWANTTRPGSCCPSASSFRGTRQPQGRYQRLAGGLRVGLLPTTTSRLAFDNLLGKVAAFAAAQGLSGSDVLVTGHSLGGLGGQPRGGHEQRSLGRLLPGRQLLGFASPTQSANSSQVLNIGYETTRCSAPWTALISTALSLGTHWQAPGVATNNIVSFTDHYSSFLGEVDSPEHPQSAVLVGPQCGGLRRGLNRLINSDFYDLTSRDSTVVISNLSEGKRDQVWVKDLNLYAEKHTGSTFIIGTQSNDLLHGGKGNDYLDGGAGDDRFRDDGGYNIIHGGQGHNVLELQQPLKNFSIANDGDGTLYIRDAYGGISMTRDVGALVSHETGSWWQLFGKDVSHSVTADGLQNGNQWTAYNHSLNGDAYGNALVASVDGDWLFGHGGDDLLSSDKANVTFVGGTGNDVMHSSGGGGNTFLFSGNFGFDLIHGYQNTDKLVFMGVPGVDAHYDYSQHLSQNGNDTLVQVFGEFLRVNPWWGSAWTSLSGSGLVFA
00024	PBS depolymerase	Acidovorax delafieldii	2002.0	PBS	Uchida, H., Shigeno-Akutsu, Y., Nomura, N., Nakahara, T., & Nakajima-Kambe, T. (2002). Cloning and sequence analysis of poly (tetramethylene succinate) depolymerase from Acidovorax delafieldii strain BS-3. Journal of bioscience and bioengineering, 93(2), 245-247.	MHLPRSRWDIPFKEETTMTHHFSVRALLAAGALLASAAVSAQTNPYERGPAPTTSSLEASRGPFSYQSFTVSRPSGYRAGTVYYPTNAGGPVGAIAIVPGFTARQSSINWWGPRLASHGFVVITIDTNSTLDQPDSRSRQQMAALSQVATLSRTSSSPIYNKVDTSRLGVMGWSMGGGGSLISARNNPSIKAAAPQAPWSASKNFSSLTVPTLIIACENDTIAPVNQHADTFYDSMSRNPREFLEINNGSHSCANSGNSNQALLGKKGVAWMKRFMDNDRRYTSFACSNPNSYNVSDFRVAACN
00025	PHB depolymerase	Caldimonas manganoxidans	2002.0	PHB PHA	Takeda, M., Kamagata, Y., Ghiorse, W. C., Hanada, S., & Koizumi, J. I. (2002). Caldimonas manganoxidans gen. nov., sp. nov., a poly (3-hydroxybutyrate)-degrading, manganese-oxidizing thermophile. International journal of systematic and evolutionary microbiology, 52(3), 895-900.	MKTRMLVGWAAAAVLAAGPAWAVQSLPRLNIDKSQISVSGLSSGGFMANQLGVAHSSTFMGVGVFAAGPYMCAGHYNYTACMYNATISDGQLSTMQSSINHWSGSQIDDKAGIAKQKIYLFVGTSDSTIGPNPMDALRKQYANNAVPTGNDEYIKRSGAAHVFPTDFDAAGNNSCGSTSSPYIANCGYDGAKAVLTRIYGTLNPRNDTPPASNYIEFSQASFTNNPGMAATGWVYVPSDCAAGAQCRLHVALHGCQQSYAQIGDKFIKNTGYTRWADTNRIVVLFPQTKVDNTSRSTAASGLLPNPNACWDWIGWYGSDFAQKGGSQISAIKAMVDHLASGAPTSTLPAPTGVSTSGATDTSMVISWASVQGAAGYHVYRNGAKQTTTPVTGTSYTDTGLTPATTYQWTVTAVDGQGAESVPSAAASGTTTGAAPPPATCYTASNYAHTTACRAYAAWGYAYAKGSNQNMGLWNIYVITTLKQTGPNHYVIGTCP
00026	PHB depolymerase	Marinobacter sp.	2003.0	PHB PHA	Kasuya, K. I., Takano, T., Tezuka, Y., Hsieh, W. C., Mitomo, H., & Doi, Y. (2003). Cloning, expression and characterization of a poly (3-hydroxybutyrate) depolymerase from Marinobacter sp. NK-1. International journal of biological macromolecules, 33(4-5), 221-226.	MQHLLSGWIRRIALPVLTLSTLIILPSLPAHAGQTDSYTLPQQAYNQSRARDYKVYVPDGLTSPAPMVMALHGCKQTNNDVLNDWGLKAAADRYGFILVAPYITSYDGLRNQNCWGFWFDHHRHEGAGEVEDLHQIALAVEGNYSIDPQRRFITGLSSGGAMTAVAAITHNEYWAAAASASGLPYGEDSSSVSLTGQCPGNATFHSVSRVVSDMQAELNDPYPIPMMVLQNKNDCTVLKKAADNIRDAHLKVFGEAGFDTPSGADAGTVNCSPYYQNDYNCTHTRYTQDGTTGTRSVVETVYLDGPLSTPNTQDTDHGHYWVSGKDGNNGKWAIRVGPSYPDIIWNFFAAHDRDGPDPEGYPVITLIGDNPMSVAIGTAFTDPGATAEDAEDGSLTVSADCSDVDTASVGTYACTYSATDSDTNETTVTRSVEVYDPKAPVETCQQATASPSGHISAGRAYAGGTSNLRAYANGDDADIGASFDSWSSVVLYEGEPGQWFSQEPSACSGVPDDGNDNGDPVACQDWNASNLSHSMAGRAYYSAGYYTTGGDDSLGPIPGTYTWVKETSAGVFEAGQCP
00027	PLA depolymerase	Paenibacillus amylolyticus	2003.0	PLA	Akutsu-Shigeno, Y., Teeraphatpornchai, T., Teamtisong, K., Nomura, N., Uchiyama, H., Nakahara, T., & Nakajima-Kambe, T. (2003). Cloning and sequencing of a poly (DL-lactic acid) depolymerase gene from Paenibacillus amylolyticus strain TB-13 and its functional expression in Escherichia coli. Appl. Environ. Microbiol., 69(5), 2498-2504.	MRKLKLLLMVCMSMVFIFTLPGMGQSLKASAATERTPIVFVHGLTGSDSNFALIERYLRGEGWSSDELFAIDLPSKAGNQLLNSAAISRFVDDVLRQTGHSKVHIVAHSMGGANSLYYILNRGGIDKVDKLITLGGANRLTTSRAPDGIRVTSIYSTSDTIVSPALSRLDGANNISVNLVTHIGLLYNSRVNALIKAALIE
00028	PHB depolymerase	Azospirillum brasilense	2003.0	PHB PHA	Kadouri, D., Jurkevitch, E., & Okon, Y. (2003). Poly β-hydroxybutyrate depolymerase (PhaZ) in Azospirillum brasilense and characterization of a phaZ mutant. Archives of microbiology, 180(5), 309-318.	MSVLHGMFGFLSPEGPSSPSDGVGSLEQVAEREAHQGPGPGDAPMLVARGDHMTTPAQPSPFHRVLGHRLLGGPFDRRGATVLSDDAARGPDPGILDHVRPGGRVACVAEPESVGRQPAAVRQAAQRMAVRTPAMLAPRSGRAGGDGTVLMFGGTVDEAGHSDQGWWLRTKPKPNLAHRTVRGNPQRWPARGNSSIAGYDESRVHRRLGTLCGTRSPLLQAGGAGGSILPLVPVRHCLYAVRQIGAIGHGKGNSAAEFGLKTTVVDGETVAITERIALRKPFCNLLHFAKPEGTPAQPRVLLVAPMSGHHATLLRGTVAALLADHDVFVTDWIDARLVPLACGRFDLDDYIDTVVTELIRFLGPQTHVIAVCQPAVPVLAAVSLMAAGDEAVQPRSMTLMGGPIDPMANPTVPVKLAATHPLSWFERNVITTVPAYYPGGFRQVYPGFIQLSGFMSMNLDRHIGEHVGLFRHLVRGDGDSAVQHRRFYDEYLSVMDLSAEFYLQTIETVFHKHSLANGTMESRGRKVEPAAIRRTAVMTVEGELDDISAPGQTESAHRLCASLPDDMRARHFQKGVGHYGIFNGRRWRESIMPAVREFIRKHD
00029	PHA depolymerase	Schlegelella thermodepolymerans	2004.0	P(3HB-co-3MP) PHA	Elbanna, K., Lütke-Eversloh, T., Jendrossek, D., Luftmann, H., & Steinbüchel, A. (2004). Studies on the biodegradability of polythioester copolymers and homopolymers by polyhydroxyalkanoate (PHA)-degrading bacteria and PHA depolymerases. Archives of microbiology, 182(2-3), 212-225.	MRSIRLKRLIAAVALGGAAAATQAASPLPRLNVDKTQISVSGLSAGGFMANQLGYAYSGTFMGVGIFAGGPYMCAGHSNYTSCMYNATITSSMRSAMQASIDNWSGAHIDPKAHVANQRVFLFVGNSDTTVGPNPMDAVHAQYQHNGVRRTARVRGRNSTAHVFPTDFDATGNNACNSTASPYIANCGYDGAKAVLSRIYGTLQPRNDAPAGANYIEFDQTAFTNNPGMASTGWVYVPANCAAGAQCRLHVALHGCQQSTGHIGDRFVKNTGYTRWADTNNIIVLFPQAKTDNTPRNTAASGMLPNPNACWDWVGWYGSNFAQKTGTQAAAIKAMVDHVASARPRLRLPAPTGVQTSGATSSSMVISWAAVQGAAGYNVYRDGTKVNATAVSGTSYTDNGLSPGTTYQWTVRAVNAQGPRPAVGPATGTTTGTAAVCFTSSNYAHVSAGRAYVSMGYTYANASHQNMGLWNVFVTTTLKQTGPNYYVIGTCP
00030	PHB depolymerase	Schlegelella sp.	2004.0	PHB PHA	Romen, F., Reinhardt, S., & Jendrossek, D. (2004). Thermotolerant poly (3-hydroxybutyrate)-degrading bacteria from hot compost and characterization of the PHB depolymerase of Schlegelella sp. KB1a. Archives of microbiology, 182(2-3), 157-164.	MRSIRLKRLIAAVALGGAAAATQAASPLPRLNVDKTQISVSGLSAGGFMANQLGYAYSGTFMGVGIFAGGPYMCAGHSNYTSCMYNATITSSMRSAMQASIDNWSGAHIDPKAHVANQRVFLFVGNSDTTVGPNPMDAVHAQYQHNGVRRTARVRGRNSTAHVFPTDFDATGNNACNSTASPYIANCGYDGAKAVLSRIYGTLQPRNDAPAGANYIEFDQTAFTNNPGMASTGWVYVPANCAAGAQCRLHVALHGCQQSTGHIGDRFVKNTGYTRWADTNNIIVLFPQAKTDNTPRNTAASGMLPNPNACWDWVGWYGSNFAQKTGTQAAAIKAMVDHVASARPRLRLPAPTGVQTSGATSSSMVISWAAVQGAAGYNVYRDGTKVNATAVSGTSYTDNGLSPGTTYQWTVRAVNAQGPRPAVGPATGTTTGTAAVCFTSSNYAHVSAGRAYVSMGYTYANASHQNMGLWNVFVTTTLKQTGPNYYVIGTCP
00031	PHB depolymerase	Schlegelella sp.	2004.0	PHB PHA	Romen, F., Reinhardt, S., & Jendrossek, D. (2004). Thermotolerant poly (3-hydroxybutyrate)-degrading bacteria from hot compost and characterization of the PHB depolymerase of Schlegelella sp. KB1a. Archives of microbiology, 182(2-3), 157-164.	MRSIRLKRLIAAVALGGAAAATQAASPLPRLNVDKTQISVSGLSAGGFMANQLGYAYSGTFMGVGIFAGGPYMCAGHSNYTSCMYNATITSSMRSAMQASIDNWSGAHIDPKAHVANQRVFLFVGNSDTTVGPNPMDAVHAQYQHNGVRRTARVRGRNSTAHVFPTDFDATGNNACNSTASPYIANCGYDGAKAVLSRIYGTLQPRNDAPAGANYIEFDQTAFTNNPGMASTGWVYVPANCAAGAQCRLHVALHGCQQSTGHIGDRFVKNTGYTRWADTNNIIVLFPQAKTDNTPRNTAASGMLPNPNACWDWVGWYGSNFAQKTGTQAAAIKAMVDHVASARPRLRLPAPTGVQTSGATSSSMVISWAAVQGAAGYNVYRDGTKVNATAVSGTSYTDNGLSPGTTYQWTVRAVNAQGPRPAVGPATGTTTGTAAVCFTSSNYAHVSAGRAYVSMGYTYANASHQNMGLWNVFVTTTLKQTGPNYYVIGTCP
00032	PEG dehydrogenase	Sphingomonas macrogoltabidus	2005.0	PEG	Ohta, T., Tani, A., Kimbara, K., & Kawai, F. (2005). A novel nicotinoprotein aldehyde dehydrogenase involved in polyethylene glycol degradation. Applied microbiology and biotechnology, 68(5), 639-646.	MCLVTLYRCTPIWVRNRGMHKFDFVVVGAGSAGCTVASRLSENGKYQVALLEAGGSHNNPLISIPFNFAFTVPKGPHNWSFETVPQEGLNGRRGYQPRGKVLGGSSSINAMVYIRGAKEDYEHWAALGNEGWSYEEVLPFFKKAQNRVKGANEYHAQGGPLTVSPPRSPNPLNDMFIKAGMDCQLPYNEDFNGETQEGIGCYELTQDRGKRCSAALAYVTPAEKRKNLTIFKQAFVEKVLVENGQATGVMVKLNGNLQLIKARREVILSCGAFQSPQLLLLSGIGAKDKLDPHKIKVVHELPGVGENLYDHVDFCLMYQSDSEHVLGKNARSVFRVAWNQFKYFAGRRGILTTNFNESGAFYFTNPDERSPDIQLHFAFTLVDQHGLKRHGRGGFGCHVCVLRPKSHGNLTLADANPATPPLIDPAFLKDERDVATLLAGVKRAQQILQAPAFDEIRGKPVYATASNNDDELIEDIRNRADTIYHPVGTCKMGPDSDPMAVVDSSLRVRGIRNLRVIDASIMPSIVSGNTNAPTIMIGEKGAQMILDEAESYT
00033	PVA hydrolase	Sphingomonas sp.	2005.0	PVA O-PVA	Klomklang, W., Tani, A., Kimbara, K., Mamoto, R., Ueda, T., Shimao, M., & Kawai, F. (2005). Biochemical and molecular characterization of a periplasmic hydrolase for oxidized polyvinyl alcohol from Sphingomonas sp. strain 113P3. Microbiology, 151(4), 1255-1262.	MFKPVVKSRSSRSFCYLAGCLAMVAATLSSTAQAKSEWACPEGFTPKAGLNTDFPSDGKKRAFVVVPPKDSAGGAPVWVPMVGTVEATNWNLNVPRSGNNAKLAEHGYMVISPVRQCAEQDPNLGAGACNGVGKDGWTWNPWNDGRAPDASGDKYKTDAGDDVRFLEAMVRCVGTKWKLDRKRLFLGGISAGGTMTNRALLFDSEFWAGGMPISGEWYSTKDDGSTVPFQETRKMVAAAPAKIWQGRVGPYPLPSKLDPMVVITVWGGEKDLWDCGPPLGLCSDYRPTTQASSNYFSSISNVVHVACSATHGHMWPQVNTDAFNLWALNTMASHPKGSSPKDFKLTAPPEGYSCKIGRFTDHYK
